{
  "$schema": "https://json-schema.org/draft/2020-12/schema",
  "$id": "validation-result.schema.json",
  "title": "SpecOps Validation Result",
  "description": "Derived technical validation evidence. This contract is not authority and constrains structural and result consistency. Authenticity and execution provenance must be established by the evidence-producing and validation process.",
  "x-contract-version": "2.0.0",
  "type": "object",
  "additionalProperties": false,
  "required": [
    "contractVersion",
    "provenance",
    "workItemId",
    "acceptanceOrCheckIds",
    "overallResult",
    "checks",
    "actualEvidence",
    "limitations",
    "unresolvedUnknowns"
  ],
  "properties": {
    "contractVersion": {
      "const": "2.0.0"
    },
    "provenance": {
      "allOf": [
        {
          "$ref": "evidence-provenance.schema.json"
        },
        {
          "properties": {
            "executedDefinition": {
              "properties": {
                "type": {
                  "const": "validation-definition"
                }
              },
              "required": [
                "type",
                "id",
                "version",
                "reference"
              ]
            }
          }
        }
      ],
      "description": "Records the claimed executed validation definition or procedure binding and execution provenance. In this validation-result context, provenance limitations and unresolved unknowns concern the execution or provenance context, including the producer, execution environment, subject identity or revision, executed definition or procedure, or provenance establishment. They are separate from top-level result limitations and unresolved unknowns; producers must classify each item by the domain it affects and must not duplicate an item across both domains merely for redundancy. This standalone schema does not authenticate the execution or compare the binding with an external definition; future producer or validator tooling must verify those relationships."
    },
    "workItemId": {
      "type": "string",
      "minLength": 1,
      "pattern": "^[A-Za-z0-9][A-Za-z0-9._-]*$"
    },
    "acceptanceOrCheckIds": {
      "type": "array",
      "minItems": 1,
      "uniqueItems": true,
      "items": {
        "type": "string",
        "minLength": 1
      }
    },
    "overallResult": {
      "enum": [
        "PASS",
        "FAIL",
        "INCONCLUSIVE"
      ]
    },
    "checks": {
      "type": "array",
      "minItems": 1,
      "items": {
        "$ref": "#/$defs/check"
      }
    },
    "actualEvidence": {
      "type": "array",
      "minItems": 1,
      "items": {
        "$ref": "#/$defs/evidence"
      }
    },
    "limitations": {
      "type": "array",
      "items": {
        "type": "string",
        "minLength": 1
      },
      "description": "Limitations of the validation result itself, including validation coverage, check coverage, result interpretation, or other limitations affecting the validation conclusion. This is separate from provenance limitations; producers must classify each item by the domain it affects and must not duplicate an item in both domains merely for redundancy."
    },
    "unresolvedUnknowns": {
      "type": "array",
      "items": {
        "type": "string",
        "minLength": 1
      },
      "description": "Unresolved unknowns affecting the validation result or its conclusion, including unanswered validation or check questions or missing result-level information. This is separate from provenance unresolved unknowns; producers must classify each item by the domain it affects and must not duplicate an item in both domains merely for redundancy."
    }
  },
  "allOf": [
    {
      "if": {
        "properties": {
          "overallResult": {
            "const": "PASS"
          }
        },
        "required": [
          "overallResult"
        ]
      },
      "then": {
        "properties": {
          "checks": {
            "not": {
              "contains": {
                "properties": {
                  "result": {
                    "enum": [
                      "FAIL",
                      "INCONCLUSIVE",
                      "NOT_EXECUTED"
                    ]
                  }
                },
                "required": [
                  "result"
                ]
              }
            }
          },
          "unresolvedUnknowns": {
            "maxItems": 0
          },
          "provenance": {
            "properties": {
              "unresolvedUnknowns": {
                "maxItems": 0
              }
            }
          }
        }
      }
    },
    {
      "if": {
        "properties": {
          "overallResult": {
            "const": "FAIL"
          }
        },
        "required": [
          "overallResult"
        ]
      },
      "then": {
        "properties": {
          "checks": {
            "contains": {
              "properties": {
                "result": {
                  "const": "FAIL"
                }
              },
              "required": [
                "result"
              ]
            }
          }
        }
      }
    },
    {
      "if": {
        "properties": {
          "overallResult": {
            "const": "INCONCLUSIVE"
          }
        },
        "required": [
          "overallResult"
        ]
      },
      "then": {
        "properties": {
          "checks": {
            "allOf": [
              {
                "not": {
                  "contains": {
                    "properties": {
                      "result": {
                        "const": "FAIL"
                      }
                    },
                    "required": [
                      "result"
                    ]
                  }
                }
              },
              {
                "contains": {
                  "properties": {
                    "result": {
                      "enum": [
                        "INCONCLUSIVE",
                        "NOT_EXECUTED"
                      ]
                    }
                  },
                  "required": [
                    "result"
                  ]
                }
              }
            ]
          }
        }
      }
    }
  ],
  "$defs": {
    "repositoryPath": {
      "type": "string",
      "minLength": 1,
      "pattern": "^(?!/)(?![A-Za-z]:)(?!.*\\\\)(?!.*(?:^|/)\\.\\.(?:/|$))(?!.*//)(?:[^/\\r\\n]+/)*[^/\\r\\n]+$"
    },
    "check": {
      "type": "object",
      "additionalProperties": false,
      "required": [
        "id",
        "executed",
        "result",
        "actualEvidence",
        "evidenceLocations",
        "limitations"
      ],
      "properties": {
        "id": {
          "type": "string",
          "minLength": 1
        },
        "executed": {
          "type": "boolean"
        },
        "result": {
          "enum": [
            "PASS",
            "FAIL",
            "INCONCLUSIVE",
            "NOT_EXECUTED"
          ]
        },
        "actualEvidence": {
          "type": "array",
          "items": {
            "type": "string",
            "minLength": 1
          }
        },
        "evidenceLocations": {
          "type": "array",
          "items": {
            "$ref": "#/$defs/repositoryPath"
          }
        },
        "exitCode": {
          "type": [
            "integer",
            "null"
          ]
        },
        "limitations": {
          "type": "array",
          "items": {
            "type": "string",
            "minLength": 1
          }
        },
        "notExecutedReason": {
          "type": "string",
          "minLength": 1
        }
      },
      "allOf": [
        {
          "if": {
            "properties": {
              "executed": {
                "const": false
              }
            },
            "required": [
              "executed"
            ]
          },
          "then": {
            "properties": {
              "result": {
                "const": "NOT_EXECUTED"
              },
              "actualEvidence": {
                "maxItems": 0
              }
            },
            "required": [
              "notExecutedReason"
            ]
          },
          "else": {
            "properties": {
              "result": {
                "enum": [
                  "PASS",
                  "FAIL",
                  "INCONCLUSIVE"
                ]
              },
              "actualEvidence": {
                "minItems": 1
              }
            }
          }
        }
      ]
    },
    "evidence": {
      "type": "object",
      "additionalProperties": false,
      "required": [
        "source",
        "observation"
      ],
      "properties": {
        "source": {
          "type": "string",
          "minLength": 1
        },
        "path": {
          "$ref": "#/$defs/repositoryPath"
        },
        "observation": {
          "type": "string",
          "minLength": 1
        }
      }
    }
  }
}
