{"acceptanceOrCheckIds":["a2-qualified-byte-continuity","a2-bootstrap-source-identity","a2-projection-validator","a2-bootstrap-core","a2-bootstrap-execution","a2-bootstrap-conformance","a2-eval-definition-tests","a2-eval-implementation-tests","g-provenance-aware-output-equivalence","g-production-bootstrap","g-fresh-child","g-unity-import-compile","g-editmode","g-playmode-not-required"],"actualEvidence":[{"observation":"Qualified candidate A2 binds Bootstrap Source Identity a92b31752e46b3f801f32400f4f6808d7a888a27d4f865486763896689225adc.","source":"I4 release-level qualification binding"},{"observation":"Projection, Bootstrap, eval-test, byte-continuity, Source Identity, and provenance-aware equivalence evidence was accepted without rerun.","source":"A2 bounded validation evidence"},{"observation":"Production Bootstrap, fresh child, Unity import/compile, and EditMode 4/4 PASS evidence carries forward through zero Unity-semantic projected output change; PlayMode remained NOT_REQUIRED.","source":"Historical G validation evidence"}],"checks":[{"actualEvidence":["The Human-reviewed six-file precommit A2 content was committed and pushed as adddb2c91f7adae6133b384440d2c3f2020f1574; branch and origin are synchronized with a clean repository and no scope drift."],"evidenceLocations":[],"executed":true,"id":"a2-qualified-byte-continuity","limitations":[],"result":"PASS"},{"actualEvidence":["Candidate A2 Source Identity is a92b31752e46b3f801f32400f4f6808d7a888a27d4f865486763896689225adc; primary and independent reproduction passed; old active bindings=0 and new active bindings=8."],"evidenceLocations":[],"executed":true,"id":"a2-bootstrap-source-identity","limitations":[],"result":"PASS"},{"actualEvidence":["Projection validator completed 32/32 PASS against canonical-LF candidate A2."],"evidenceLocations":[],"executed":true,"id":"a2-projection-validator","limitations":[],"result":"PASS"},{"actualEvidence":["Bootstrap Core completed 224/224 PASS against canonical-LF candidate A2."],"evidenceLocations":[],"executed":true,"id":"a2-bootstrap-core","limitations":[],"result":"PASS"},{"actualEvidence":["Bootstrap Execution completed 141/141 PASS against canonical-LF candidate A2."],"evidenceLocations":[],"executed":true,"id":"a2-bootstrap-execution","limitations":[],"result":"PASS"},{"actualEvidence":["Bootstrap Conformance completed 302/302 PASS against canonical-LF candidate A2."],"evidenceLocations":[],"executed":true,"id":"a2-bootstrap-conformance","limitations":[],"result":"PASS"},{"actualEvidence":["Eval-definition tests completed 304/304 PASS against candidate A2."],"evidenceLocations":[],"executed":true,"id":"a2-eval-definition-tests","limitations":[],"result":"PASS"},{"actualEvidence":["Eval-implementation tests completed 126/126 PASS against candidate A2."],"evidenceLocations":[],"executed":true,"id":"a2-eval-implementation-tests","limitations":[],"result":"PASS"},{"actualEvidence":["A and A2 projected 312 identical paths; 311/311 non-provenance outputs were exact-byte identical; only .specops/bootstrap.json differed, solely at /sourceBaseline/sourceIdentity/digest; Unity-semantic changed outputs=0."],"evidenceLocations":[],"executed":true,"id":"g-provenance-aware-output-equivalence","limitations":[],"result":"PASS"},{"actualEvidence":["Established G evidence records a successful production Bootstrap execution from canonical source."],"evidenceLocations":[],"executed":true,"id":"g-production-bootstrap","limitations":[],"result":"PASS"},{"actualEvidence":["Established G evidence records a successful fresh-child construction and fresh lifecycle state."],"evidenceLocations":[],"executed":true,"id":"g-fresh-child","limitations":[],"result":"PASS"},{"actualEvidence":["Established G evidence records successful Unity package resolution, import, and compilation."],"evidenceLocations":[],"executed":true,"id":"g-unity-import-compile","limitations":[],"result":"PASS"},{"actualEvidence":["Historical G EditMode validation completed 4/4 PASS and carries forward because the accepted A-to-A2 equivalence established zero Unity-semantic projected output changes."],"evidenceLocations":[],"executed":true,"id":"g-editmode","limitations":[],"result":"PASS"},{"actualEvidence":["PlayMode was not executed because the established validation determined PlayMode was NOT_REQUIRED; this PASS applies to the disposition check, not to PlayMode execution."],"evidenceLocations":[],"executed":true,"id":"g-playmode-not-required","limitations":[],"result":"PASS"}],"contractVersion":"2.0.0","limitations":["This result aggregates previously accepted Human Authority evidence; the I4 materialization process did not rerun the underlying validations.","Compilation warnings are diagnostic only and are not deterministically normalized by the production adapter."],"overallResult":"PASS","provenance":{"contractVersion":"1.0.0","executedAtUtc":"2026-08-29T09:27:58.2787126Z","executedDefinition":{"id":"specops-v2-release-validation-aggregation","reference":"procedures/specops-v2-release-validation-aggregation.v1.json","type":"validation-definition","version":"1.0.0"},"executionId":"8b9e5654-9402-4fac-8df8-87f358c606df","governingContracts":[{"id":"validation-result.schema.json","reference":".specops/contracts/validation-result.schema.json","version":"2.0.0"},{"id":"evidence-provenance.schema.json","reference":".specops/contracts/evidence-provenance.schema.json","version":"1.0.0"}],"limitations":[],"producer":{"id":"specops-v2-release-evidence-materialization-process","version":"1.0.0"},"subject":{"id":"specops-unity-reference-implementation","revision":{"identifier":"adddb2c91f7adae6133b384440d2c3f2020f1574","scheme":"git-commit-sha1"},"type":"repository"},"targetScope":[{"id":"specops-v2.0.0-a2","type":"release-candidate-technical-qualification"}],"unresolvedUnknowns":[]},"unresolvedUnknowns":[],"workItemId":"specops-v2.0.0-release-validation-a2"}