{"contractVersion":"2.0.0","provenance":{"contractVersion":"1.0.0","subject":{"type":"repository","id":"specops-unity-reference-implementation","revision":{"scheme":"git-commit-sha1","identifier":"53595414f559d884d6d34ecafa7d350c1da96955"}},"executionId":"6b4329eb-8dac-4c6f-951d-606def335a5c","producer":{"id":"specops-v2.0.1-release-evidence-materialization-process","version":"1.0.0"},"executedDefinition":{"type":"validation-definition","id":"specops-v2.0.1-release-validation-aggregation","version":"1.0.0","reference":"procedures/specops-v2.0.1-release-validation-aggregation.v1.json"},"governingContracts":[{"id":"validation-result.schema.json","version":"2.0.0","reference":".specops/contracts/validation-result.schema.json"},{"id":"evidence-provenance.schema.json","version":"1.0.0","reference":".specops/contracts/evidence-provenance.schema.json"}],"targetScope":[{"type":"release-candidate-technical-qualification","id":"specops-v2.0.1-qualified-subject"}],"executedAtUtc":"2026-08-30T06:36:20.3342357Z","limitations":[],"unresolvedUnknowns":[]},"workItemId":"specops-v2.0.1-release-validation-qualified-subject","acceptanceOrCheckIds":["qualified-subject-binding","rmd-001-remediation","rmd-t01-portability","rv1-fresh-no-rg","rv2-production-bootstrap-and-projection","rv3-static-acceptance","rv4-unity-consumer-validation","accepted-evidence-integrity"],"overallResult":"PASS","checks":[{"id":"qualified-subject-binding","executed":true,"result":"PASS","actualEvidence":["Qualified subject is git-commit-sha1:53595414f559d884d6d34ecafa7d350c1da96955; origin/specops-v2 is synchronized; producer worktree is clean; Bootstrap Source Identity is 82df3aed63dc2ab32d5e641db7c8fac81b6924236e146bf0be59deb213c8abe9."],"evidenceLocations":[],"limitations":[]},{"id":"rmd-001-remediation","executed":true,"result":"PASS","actualEvidence":["RMD-001 implementation passed bounded remediation validation: Bootstrap Projection 32 PASS, Core 238 PASS, Execution 143 PASS, Conformance 302 PASS, output 312; child authority/onboarding projection defects were remediated."],"evidenceLocations":[],"limitations":[]},{"id":"rmd-t01-portability","executed":true,"result":"PASS","actualEvidence":["RMD-T01 removed the undeclared rg prerequisite; fresh sanitized no-rg validation passed with Bootstrap Projection 40 PASS and Source Identity 82df3aed63dc2ab32d5e641db7c8fac81b6924236e146bf0be59deb213c8abe9."],"evidenceLocations":[],"limitations":[]},{"id":"rv1-fresh-no-rg","executed":true,"result":"PASS","actualEvidence":["RMD-T01-RV1 used a fresh public remote-derived detached clean source at the qualified revision; rg was unavailable under the sanitized environment and Bootstrap Projection completed 40 PASS before Bootstrap authorization."],"evidenceLocations":[],"limitations":[]},{"id":"rv2-production-bootstrap-and-projection","executed":true,"result":"PASS","actualEvidence":["RMD-T01-RV2 performed exactly one production Bootstrap invocation with exit code 0 and materialized 312 files; consumer authority projection and agent routing/onboarding projection both passed; no second Bootstrap run occurred."],"evidenceLocations":[],"limitations":[]},{"id":"rv3-static-acceptance","executed":true,"result":"PASS","actualEvidence":["RMD-T01-RV3-R1 completed the established clean-consumer static Golden Baseline suite 13/13 PASS with source and child integrity preserved."],"evidenceLocations":[],"limitations":[]},{"id":"rv4-unity-consumer-validation","executed":true,"result":"PASS","actualEvidence":["RMD-T01-RV4 performed exactly one qualified Unity 6000.5.8f1 (5cb7df797b7d) invocation: 8/8 RV4 checks PASS, compilation errors 0, required/discovered/passed EditMode tests 4/4, and all 312 Bootstrap-materialized files remained exact-byte preserved."],"evidenceLocations":[],"limitations":[]},{"id":"accepted-evidence-integrity","executed":true,"result":"PASS","actualEvidence":["R3A and R3B consumed the prior RMD/RV acceptance as established evidence; consumer Bootstrap and consumer Unity were not rerun. Four candidate-bound production evals were executed separately against the qualified producer subject."],"evidenceLocations":[],"limitations":[]}],"actualEvidence":[{"source":"RMD-001 and RMD-T01 Human Authority acceptance","observation":"The consumer authority/onboarding remediation and projection-validator portability remediation were implemented, committed, pushed, and accepted before fresh-consumer validation."},{"source":"RMD-T01 fresh consumer RV1-RV4","observation":"Fresh no-rg validation, exactly-one production Bootstrap, 13/13 static acceptance, and exactly-one Unity consumer validation all passed."},{"source":"R3 qualified-subject evidence production","observation":"R3A/R3B preserved the qualified producer repository and did not rerun the accepted consumer Bootstrap or consumer Unity validations."}],"limitations":["This result aggregates previously accepted Human Authority RMD/RV evidence; R3C does not rerun those underlying validations."],"unresolvedUnknowns":[]}
